{
  "slug": "example-article",
  "title": "Example Article",
  "subtitle": "Reusable article schema starter",
  "description": "A starter content file showing the shape future article API responses should follow.",
  "date": "2026-06-16",
  "readTime": "2 minutes read",
  "category": "Article",
  "seo": {
    "title": "Example Article",
    "description": "A starter content schema for future article pages.",
    "keywords": ["innovation", "technology", "articles"]
  },
  "sections": [
    {
      "type": "text",
      "heading": "Overview",
      "content": "Add article body sections here. Later this same structure can come from an API or CMS."
    }
  ]
}
